,location,time,sallary,name,duty
4723,西安,3月9日,5-7万/月,陕西阳光汽车服务有限公司,机票销售客服专员
4724,北京,3月9日,10万以上/月,北京美时霖国际贸易有限公司,销售总监
4725,合肥,3月9日,8-12万/月,安徽省缘毅空调设备有限公司,业务经理
4726,西安,3月9日,7-10万/月,济南正熙医疗科技有限公司,philips CT维修工程师
4727,上海-闵行区,3月9日,5-7万/月,丸一精密模具（上海）有限公司,模具设计
4728,异地招聘,3月9日,5-7万/月,长春金赛药业股份有限公司,大区经理-嘉湖绍
4729,南京,3月9日,5-7万/月,朗诗集团股份有限公司,00140-集团设计总监
4730,芜湖,3月9日,8-12万/月,银峰铸造（芜湖）有限公司,项目工程师
4731,上海-徐汇区,3月9日,100万以上/年,日太餐饮管理（上海）有限公司,招商加盟总监
4732,武汉,3月9日,8-12万/月,武汉永力科技股份有限公司,区域销售经理
4733,合肥-政务区,3月9日,60-100万/年,厚益控股管理有限公司,高级经理、高级招生顾问
4734,深圳-福田区,3月9日,5-7万/月,深圳市万生堂实业有限公司,电商运营总监
4735,深圳-南山区,3月9日,7-10万/月,深圳新恒业科技股份有限公司,新能源项目拓展总监
4736,宁波-海曙区,3月9日,8-12万/月,凯盛建设有限公司,安全员
4737,苏州,3月9日,60-80万/年,苏州递增资产管理有限公司,投行项目经理
4738,武汉,3月9日,5-8万/月,湖北楚商资本投资控股有限公司,研发总监
4739,广州-天河区,3月9日,10-20万/月,广东易恒律师事务所,执证律师
4740,广州-白云区,3月9日,5-7万/月,广东久和建筑装饰工程有限公司,造价工程师
4741,杭州,3月9日,7-10万/月,杭州忆米科技有限公司,平面设计师
4742,广州-天河区,3月9日,6-12万/月,广州市广农数链信息科技有限公司,销售代表
4743,武汉-江汉区,3月9日,7-10万/月,武汉必立康生物科技有限公司,资深网店摄影师
4744,广州-海珠区,3月9日,60-80万/年,欢朋酒店管理（广州）有限公司,希尔顿欢朋-运营支持总监/运营副总裁
4745,江苏省,3月9日,7-15万/月,爱飞纽（广州）医疗器械贸易有限公司,江苏、安徽大区销售经理
4746,上海-长宁区,3月9日,7-10万/月,欢乐传媒,销售总监
4747,广州-天河区,3月9日,80-100万/年,广州市钱大妈农产品有限公司,大数据部门leader
4748,合肥-庐阳区,3月9日,8-15万/月,合肥培蕾艺术中心有限公司,储备校长
4749,深圳-南山区,3月9日,30-50万/月,深圳市有棵树科技股份有限公司,产品经理或高级产品经理
4750,深圳-福田区,3月9日,5-8万/月,深圳市捷顺科技实业股份有限公司,技术总监
4751,芜湖,3月9日,6-8万/月,奇瑞安川电驱动系统有限公司,总账会计
4752,深圳-龙华新区,3月9日,7-10万/月,深圳顺络电子股份有限公司,项目管理工程师
4753,北京-大兴区,3月9日,5-7万/月,上海栗德机电工程技术有限公司,人事经理
4754,异地招聘,3月9日,10-20万/月,广东寰球智能科技有限公司,后端工程师
4755,成都,3月9日,10万以上/月,北京壹号车科技有限公司四川分公司,开元金融代理人
4756,深圳-光明新区,3月9日,4500元/天,深圳市易世通达贸易有限公司,客诉专员
4757,上海-长宁区,3月9日,7-9万/月,上海曲约企业管理咨询有限公司,营销总监（酒店渠道照明业务，B2B)
4758,上海-浦东新区,3月9日,100万以上/年,甘肃刚泰控股（集团）股份有限公司,财务副总裁
4759,郑州-管城回族区,3月9日,5-7万/月,河南龙瑞装饰工程有限公司,家装设计师
4760,深圳-南山区,3月9日,20-35万/月,深圳市有棵树科技有限公司,高级测试经理
4761,上海-徐汇区,3月9日,5-7万/月,上海众言网络科技有限公司,行业咨询总监
4762,深圳-宝安区,3月9日,100万以上/年,深圳市达实智控科技股份有限公司,销售总监
4763,北京-海淀区,3月9日,15-35万/月,天职工程咨询股份有限公司,项目总监（管理咨询）
4764,异地招聘,3月9日,5-7万/月,昆山市玉山镇鼎尚食品商行,淘宝美工
4765,中山,3月9日,10万以上/月,上海德润宝特种润滑剂有限公司,销售助理
4766,廊坊,3月9日,400-500万/月,河北顺丰速运有限公司廊坊分公司,00851-物流调度专员
4767,异地招聘,3月9日,20-35万/月,俊发地产有限责任公司,主管景观设计师
4768,异地招聘,3月9日,5-10万/月,浙江超人科技股份有限公司,外贸业务员
4769,广州-越秀区,3月9日,8-15万/月,广东庆达咨询有限公司,工程咨询师
4770,深圳-龙岗区,3月9日,5000元/小时,深圳市友通塑焊机械有限公司,电工
4771,杭州-西湖区,3月9日,8-12万/月,杭州喔影网络科技有限公司,Android开发工程师
4772,广州-天河区,3月9日,6-10万/月,广东粤银金投控股集团有限公司,信贷经理
4773,北京,3月9日,5-7万/月,思博伦通信科技（北京）有限公司,Senior Software Architect
4774,东莞-长安镇,3月9日,5-7万/月,深圳市粤润通吊装运输有限公司,板车司机
4775,无锡-江阴市,3月9日,5-10万/月,江阴伟龙服装有限公司,加工中心操作工
4776,苏州-吴江区,3月9日,4000元/小时,海门市朱莉烤肉店,吴江万宝店高薪聘请餐厅领班
4777,杭州-西湖区,3月9日,80-100万/年,北京悦淘金信息技术有限公司,事业部经理
4778,广州-天河区,3月9日,60-80万/年,深圳市诺德协融投资咨询有限公司广...,销售代表/高额提成/超赞福利
4779,异地招聘,3月9日,7-10万/月,先正达（中国）投资有限公司,Seeds BD Manager
4780,广州-黄埔区,3月9日,10-12万/月,广州飞歌汽车音响有限公司,销售省区经理
4781,异地招聘,3月9日,18-30万/月,广东联结电子商务有限公司,商务经理（名企代招）
4782,武汉-蔡甸区,3月9日,6-8万/月,武汉洁美乐科技有限公司,渠道分销经理
4783,异地招聘,3月9日,5-7万/月,安徽安国会计师事务所（普通合伙）,审计项目经理
4784,福州-闽侯县,3月9日,10万以上/月,智恒科技股份有限公司,企宣专员
4785,深圳,3月9日,100万以上/年,深圳市铁汉生态环境股份有限公司,首席规划师
4786,上海-嘉定区,3月9日,12-25万/月,奥托立夫（上海）管理有限公司,高级销售工程师-日系客户 （Sr.) Sales Engineer
4787,杭州,3月9日,60-100万/年,金茂置业（杭州）有限公司,项目总经理
4788,武汉-洪山区,3月9日,15-30万/月,湖北长江出版传媒集团全洲实业有限...,工程总监
4789,上海,3月9日,10-20万/月,上海永乐街企业发展有限公司,人事经理
4790,上海,3月9日,100万以上/年,上海佰万仓网络科技有限公司,技术总监
4791,深圳-光明新区,3月9日,7-10万/月,深圳市合利来科技有限公司,生产经理
4792,青岛-城阳区,3月9日,10万以上/月,青岛华顺昌木工机械制造有限公司,外贸销售
4793,苏州,3月9日,4000元/天,苏州三值精密仪器有限公司,招标专员
4794,重庆-江北区,3月9日,7-10万/月,重庆市建之森企业管理咨询有限公司,二级房建建造师
4795,上海,3月9日,100万以上/年,德马吉国际展览有限公司,销售副总裁（百万年薪）
4796,上海-松江区,3月9日,10-15万/月,上海溯慕网络科技有限公司,财务经理
4797,杭州-萧山区,3月9日,100万以上/年,遁一资产管理有限公司,金融市场部业务总监（资金方向）
4798,厦门,3月9日,5-7万/月,上海安吉星信息服务有限公司厦门分...,电销专员（试用期6险1金）
4799,深圳-龙华新区,3月9日,2130元/小时,卓科特实业（深圳）有限公司,质检部文员
4800,广州,3月9日,60-80万/年,广州市重逢服饰有限公司,YOURAN设计总监
4801,上海,3月9日,350元/小时,上海雅力信息科技有限公司,A Level 物理/化学/数学老师（Part-time）
4802,惠州,3月9日,4800元/天,惠州市富丽电子有限公司,储备干部 /生产储备干部 /实习储备干部
4803,惠州,3月9日,7-10万/月,惠州市我爱我家房地产服务有限公司,房产销售
4804,榆林,3月9日,7-10万/月,榆林市榆阳区大漠军旅文化园管理有...,总经理
4805,异地招聘,3月9日,60-80万/年,杭州瑞诺企业管理咨询有限公司,Sales/Business Development Manager
4806,武汉-蔡甸区,3月9日,5-7万/月,武汉新农牛肉卤制品有限公司,销售副总
4807,北京-东城区,3月9日,5-7万/月,盛世国祥资本管理集团有限公司,电销专员/电销代表/电话销售（双休+高提成）
4808,成都-青羊区,3月9日,100万以上/年,四川思肯投资有限公司,百万年薪 房产投资收购副总（公司合伙人）
4809,天津,3月9日,5-7万/月,万得信息技术股份有限公司（Wind资...,销售代表
4810,东莞-长安镇,3月9日,5000元/小时,东莞市锦康光电有限公司,组装技术员
4811,深圳-宝安区,3月9日,3800元/小时,深圳市裕临电子有限公司,仓管
4812,深圳,3月9日,10-20万/月,深圳市维新教育科技有限公司,工艺工程师 (光伏后道)
4813,杭州-西湖区,3月9日,100-300万/年,宽华投资集团有限公司,投行部副总经理
4814,广州-天河区,3月9日,7-10万/月,广州金博士互联网信息服务有限公司,直播间讲师（期货营业部）
4815,上海-闵行区,3月9日,60-80万/年,广汽菲亚特克莱斯勒汽车销售有限公司,产品规划高级经理（进口车）
4816,苏州-工业园区,3月9日,5-7万/月,苏州科盛股权投资管理股份有限公司,财务总监
4817,深圳-龙华新区,3月9日,4000元/天,深圳市瑞福联科电子有限公司,SMT物料员
4818,珠海,3月9日,80-100万/年,深圳泛华联合投资集团有限公司珠海...,高级财富经理(代招）
4819,深圳,3月9日,5-8万/月,深圳前海用友力合金融服务有限公司,贷款电话销售（友金普惠）
4820,岳阳,3月9日,10万以上/月,岳阳市海纳软件技术有限公司,Java高级开发工程师
4821,西安,3月9日,7-10万/月,陕西华创实业有限公司,物业管理经理
4822,深圳-罗湖区,3月9日,100万以上/年,深圳乐陶陶国际旅行社有限公司,副总经理（股权投资）
4823,异地招聘,3月9日,100万以上/年,绍兴企盟网络设计有限公司,工厂经理
4824,杭州-西湖区,3月12日,7-10万/月,杭州星合股权投资有限公司,周末双休高薪金融培训讲师
4825,上海,3月9日,350元/小时,上海达卜留文化传播有限公司,SAT阅读老师 全职或***
4826,成都,3月9日,5-7万/月,金堂家兴结石病医院,内科医生
4827,广州-番禺区,3月9日,5-7万/月,广东中原地产代理有限公司迎宾路分...,物业顾问
4828,广州-越秀区,3月9日,5-7万/月,广州裕丰咨询顾问有限公司明月分公司,招聘 星级客户经理 店长 同时招毕业生和实习生
4829,异地招聘,3月9日,10-30万/月,宁波世际波斯工具有限公司,驻广东销售总监
4830,武汉-洪山区,3月9日,12-16万/月,武汉和信益科技有限公司,项目管理部部长
4831,苏州,3月9日,20-30万/月,记忆科技（深圳）有限公司,软件工程师-接口
4832,北京,3月9日,5-7万/月,北京市道成律师事务所,提成律师
4833,异地招聘,3月9日,10万以上/月,江苏恩华药业股份有限公司,医药销售代表
4834,上海-浦东新区,3月9日,5-7万/月,上海连尚网络科技有限公司,DSP广告算法专家
4835,上海-黄浦区,3月9日,80-100万/年,上海车赢信息技术有限公司,销售精英（年薪百万）
4836,广州-海珠区,3月9日,7-10万/月,广州创必承信息科技有限公司,运营经理
4837,上海-闵行区,3月9日,20-30万/月,上海智思信息科技有限公司,高级BI工程师（商业智能与可视化）
4838,宁波-鄞州区,3月9日,6-7.5万/月,宁波铭睿时尚创意进出口有限公司,服装外贸单证员
4839,异地招聘,3月9日,12-20万/月,宁波海尔施基因科技有限公司,研发工程师
4840,上海-宝山区,3月9日,60-80万/年,大华集团商业管理中心,商管中心商业运营副总
4841,上海-浦东新区,3月9日,5-7万/月,上海晟凯礼品有限公司,国内客户经理
4842,武汉,3月9日,7-10万/月,美好建筑装配科技有限公司,规划设计院院长
4843,上海,3月9日,10-50万/月,上海康夷企业管理咨询有限公司,销售经理
4844,广州-番禺区,3月9日,15-20万/月,广州艾捷斯医疗器械有限公司,销售经理
4845,珠海,3月9日,10万以上/月,德豪润达LED照明事业部,结构工程师
4846,宁德,3月9日,60-80万/年,宁德新能源科技有限公司,精益经理（Lean manager）
4847,广州-白云区,3月9日,80-100万/年,骆驼服饰,财务副总
4848,上海-徐汇区,3月9日,7-10万/月,安徽乐金健康科技股份有限公司,市场经理
4849,宁波,3月9日,7-10万/月,宁波博视眼科医院有限公司,眼科医生
4850,成都-高新区,3月9日,10-15万/月,和和有限公司,省级销售总经理
4851,上海,3月9日,100万以上/年,上海红星美凯龙房地产有限公司,项目营销总监（长三角区域或华北区域）
4852,衢州,3月9日,5-10万/月,华盛达控股集团,江山原乡度假村有限公司（江山）-项目前期专员/经理
4853,广州,3月9日,10-20万/月,国光电器股份有限公司,市场销售总监
4854,东莞,3月9日,7-10万/月,广东银禧科技股份有限公司,动力电池系统结构设计工程师
4855,上海-普陀区,3月9日,800-2000万/月,朗诗地产集团资产运营事业部,00370-法务主管/专员
4856,上海-浦东新区,3月9日,80-100万/年,上海海和药物研究开发有限公司,临床医师（医学总监）
4857,上海-浦东新区,3月9日,10万以上/月,上海嘉盟网络技术有限公司,文案编辑 平米设计 摄影师
4858,深圳-光明新区,3月9日,5-7万/月,丁泉科技有限公司,销售代表
4859,杭州,3月9日,15-25万/月,东莞市华尊翔瀛企业管理咨询有限公司,服务器软件开发工程师
4860,异地招聘,3月9日,10万以上/月,辽宁丰烁人力资源有限公司,日本行政助理
4861,成都-温江区,3月9日,80-100万/年,成都连康投资有限公司,产业销售总监
4862,北京-东城区,3月9日,10万以上/月,精诚徽药药业股份有限公司,省区经理（北京）
4863,上海-徐汇区,3月9日,100-300万/年,上海益学投资咨询有限公司,讲师（百万年薪）
4864,广州-天河区,3月9日,5-7万/月,广州阿玛施眼科飞秒激光中心,市场总监
4865,南京,3月9日,20-40万/月,绿地集团江苏事业部,绿地会总经理/副总经理
4866,苏州,3月9日,5-7万/月,苏州工业园区美年诊所有限公司,CT医生
4867,上海,3月9日,10万以上/月,观致汽车有限公司,Big Data Architect
4868,天津,3月9日,5-7万/月,恒盛地产控股有限公司,项目公司总经理
4869,上海-虹口区,3月9日,8-14万/月,上海铭信息科技有限公司,高级数据分析师
4870,深圳-宝安区,3月9日,10万以上/月,深圳市东方升餐饮管理服务有限公司,副总经理
4871,云南省,3月9日,60-80万/年,云南腾晋物流股份有限公司,物流业务副总经理
4872,杭州-滨江区,3月9日,60-80万/年,聚光科技(杭州)股份有限公司,营销管理部总经理（水环境板块）
4873,清远,3月9日,10万以上/月,碧桂园营销广清二部,房地产销售
4874,深圳-罗湖区,3月9日,400元/小时,深圳市多科特文化传媒有限公司,医学老师/医学博士/医学硕士
4875,武汉-江岸区,3月9日,1000元/小时,上海灵兮信息科技有限公司,网络推广专员
4876,异地招聘,3月9日,15-35万/月,上海海得控制系统股份有限公司,销售经理/销售工程师（成套设备代加工业务）
4877,南京-建邺区,3月9日,10-20万/月,南京龙贞自动化装备技术有限公司,MES售前顾问
4878,常州-新北区,3月9日,8-10万/月,常州默思教育信息咨询有限公司,8万-10万高薪聘请初高中化学老师
4879,异地招聘,3月9日,12-18万/月,株洲嘉成科技发展有限公司,机械设计工程师
4880,青岛,3月9日,7-10万/月,青岛天之久塑料包装有限公司,印刷工
4881,杭州,3月9日,5-7万/月,浙江淄ü┯α垂芾碛邢薰司,大车驾驶员
4882,异地招聘,3月9日,60-80万/年,无锡盈华置业有限公司,投资拓展经理
4883,上海-黄浦区,3月9日,7-10万/月,世登（上海）信息科技有限公司,Senior Sales Manager
4884,成都,3月9日,5-8万/月,四川香天下餐饮管理有限公司,运营总经理
4885,佛山,3月9日,15-35万/月,广东三维家信息科技有限公司,大客户销售
4886,广州-南沙区,3月9日,10万以上/月,广州尚纯净水科技有限公司,销售经理 大区销售经理 销售总监
4887,杭州-拱墅区,3月9日,7-12万/月,杭州俪上贸易有限公司,业务跟单-服装
4888,北京-通州区,3月9日,7-10万/月,北京格勤世纪教育科技有限公司,营销总经理
4889,北京,3月9日,7-10万/月,北京飞亚视科技发展有限公司,海外销售顾问
4890,佛山,3月9日,3500元/小时,佛山良辉电子有限公司,仓管员
4891,嘉兴,3月9日,5-7万/月,嘉兴广星精密模具有限公司,线切割师博
4892,南通,3月9日,5-7万/月,江苏省苏商发展促进会,大客户代表
4893,珠海,3月9日,6-10万/月,珠海联邦制药股份有限公司,制药工艺员
4894,深圳-罗湖区,3月9日,5-7万/月,深圳圣园文化发展有限公司,销售总监
4895,深圳-光明新区,3月9日,5-7万/月,深圳市宏力玻璃有限公司,技工
4896,南昌,3月9日,10万以上/月,南昌成功针织制衣有限公司,生产厂长
4897,武汉-洪山区,3月9日,7-10万/月,武汉盛世同康医药科技有限公司,营销副总经理
4898,济南,3月9日,5-7万/月,济南泽源房地产经纪有限公司,21世纪房产销售
4899,异地招聘,3月9日,6-12万/月,成都凯富科技有限公司,APP产品经理/产品助理
4900,四川省,3月9日,30-50万/月,爱威科技股份有限公司,区域销售总监（四川）
4901,深圳-福田区,3月9日,10-20万/月,深圳顶呱呱企业管理有限公司,互联网资质业务经理
4902,上海,3月9日,10万以上/月,上海微特生物技术有限公司,质量经理
4903,上海-静安区,3月9日,7-10万/月,上海上外国际教育交流信息中心,人力资源经理
4904,异地招聘,3月9日,10万以上/月,上海丫肯化工有限公司,销售中心大区经理
4905,上海-闵行区,3月9日,80-100万/年,杭州味全食品有限公司,全国KA总监
4906,广州-天河区,3月9日,1000元/小时,广州主角教育科技有限公司,微课老师
4907,深圳-南山区,3月9日,7-10万/月,深圳市华尔街资本管理有限公司,房产金融客户经理
4908,南京,3月9日,5-7万/月,南京蓝光和骏置业有限公司,项目总监/总经理
4909,上海-黄浦区,3月9日,10-25万/月,爱尚岗网络科技（上海）有限公司,产品经理
4910,苏州,3月9日,5-7万/月,苏州博优达精密机械有限公司,CNC编程加操机
4911,武汉-武昌区,3月9日,60-80万/年,武汉优维康健康管理咨询有限公司,大客户经理
4912,珠海,3月9日,15-20万/月,珠海红馆房地产顾问有限公司,销售经理
4913,杭州-余杭区,3月9日,7-10万/月,杭州妥妥网络科技有限公司,钢琴、吉他老师（***）
4914,异地招聘,3月9日,3000元/天,北京中能瑞泰电气有限公司,销售经理-西安
4915,异地招聘,3月9日,10万以上/月,零氪科技（北京）有限公司,招聘主管
4916,广州-天河区,3月9日,60-80万/年,奥园,组织发展总监助理/副总监J11275
4917,吉林,3月9日,5-7万/月,长春拜博口腔医院有限公司,口腔医生
4918,杭州-余杭区,3月9日,7-10万/月,杭州绿城颐居投资管理有限公司,医务科主任
4919,北京-海淀区,3月9日,7-10万/月,四开花园网络科技（天津）有限公司...,广告营销总监
4920,深圳,3月9日,5-7万/月,招商局蛇口工业区控股股份有限公司,规划设计总监
4921,南京,3月9日,60-80万/年,保利江苏房地产发展有限公司,项目总经理
4922,杭州,3月9日,25-35万/月,中安金控,汽车金融部副总经理
4923,眉山,3月9日,7-10万/月,成都市众鑫农用化工有限责任公司,眉山分公司销售经理
4924,北京-朝阳区,3月9日,5-8万/月,北京那么值信息科技有限公司,品类运营经理/总监
4925,上海,3月9日,10-20万/月,上海宝腾电子科技有限公司,嵌入式开发工程师
4926,上海,3月9日,5-7万/月,上海瀚叶投资控股有限公司,董事会秘书（上市公司）
4927,杭州-西湖区,3月8日,10-20万/月,侬享时代网络科技有限公司,Java高级开发工程师
4928,宁波-北仑区,3月8日,60-80万/年,宁波市厚朴人力资源服务有限公司,销售总监（汽配，上市公司）
4929,沈阳-新民市,3月8日,5-7万/月,沈阳市于洪区奥诚门业加工厂,木工
4930,重庆-渝北区,3月8日,7-10万/月,重庆若可网络安全测评技术有限公司,等保测评及信息安全咨询师（西藏）
4931,杭州-滨江区,3月8日,5-7万/月,上海袋虎信息技术有限公司杭州分公司,销售总监
4932,深圳,3月8日,15-40万/月,深圳市东方聚成科技有限公司,FPGA算法工程师
4933,广州-天河区,3月8日,400元/小时,广州市泰美广告有限公司,璀璨婚纱新款网拍模特/新人微胖均可
4934,杭州-萧山区,3月8日,7-10万/月,杭州群杰装饰工程有限公司,家装顾问
4935,济南-高新区,3月8日,10万以上/月,山东贝利工程咨询有限公司,自动化设计工程师
4936,上海-徐汇区,3月8日,7-10万/月,争鲜（上海）食品有限公司,人力资源经理
4937,郑州,3月8日,5-7万/月,河南卓远汽车销售有限公司,销售内勤
4938,上海-普陀区,3月8日,5-7万/月,上海昱辉能源科技有限公司,财务副总裁
4939,上海-长宁区,3月8日,10-20万/月,纳瓦电子（上海）有限公司,汽车电子高级软件工程师
4940,上海-长宁区,3月8日,10000元/天,上海力友翻译有限公司,***法语翻译
4941,常州,3月8日,6-12万/月,江苏叶迪车灯有限公司,SQE
4942,济南-市中区,3月8日,100-500万/年,倍特期货有限公司济南营业部,期货交易员
4943,东莞-麻涌镇,3月8日,100-180万/年,新港码头,总经理
4944,青岛-崂山区,3月8日,10万以上/月,标尺集团,市场/销售专员
4945,上海,3月8日,2500元/天,上海英格尔认证有限公司,环境事业部管培生
4946,上海,3月8日,10-12万/月,上海事成软件股份有限公司,财务主管
4947,广州,3月8日,5-6万/月,汇桔网,营销总经理
4948,重庆,3月8日,100万以上/年,重庆市贞观科技有限公司,副总经理-重庆云鬟科技股份有限公司
4949,杭州-西湖区,3月8日,10万以上/月,杭州欧凯膜技术有限公司,普工
4950,上海,3月8日,80-100万/年,阿斯麦-中国,Business Unit Manager_Brion Business
4951,长沙,3月8日,5-7万/月,湖南海洋胶囊有限公司,国际贸易
4952,珠海,3月8日,3000元/天,珠海深妙医疗新技术开发有限公司,***医生
4953,温州,3月8日,5-7万/月,温州市鹿城区金宝贝培训有限公司,渠道经理主管
4954,异地招聘,3月8日,1000元/小时,弘瑞文化传媒,北京长期招聘模特礼仪
4955,中山,3月8日,60-80万/年,中山市华明智能科技有限公司,销售总经理
4956,南京,3月8日,10万以上/月,江苏银凤金革资产管理有限公司,市场营销总监
4957,佛山,3月8日,5-7万/月,佛山市南海嘉富宝家居用品厂,3D设计师
4958,北京-朝阳区,3月8日,20-35万/月,武汉元光科技有限公司,财务总监
4959,上海-闵行区,3月8日,7-10万/月,上海琪辕汽车服务有限公司,滴滴网约司机，现车现提
4960,北京,3月8日,60-80万/年,北京华尔街英语培训中心有限公司,中心销售副总监/副校长
4961,异地招聘,3月8日,80-100万/年,云南则道茶业股份有限公司,营销总监（深圳城市总服务商）
4962,北京-东城区,3月8日,15-25万/月,北京聚众互动网络科技有限公司,Android开发工程师
4963,福州-福清市,3月8日,15-20万/月,福建三锋控股集团有限公司,滚压亮饰条项目产品工艺
4964,广州-越秀区,3月8日,400元/小时,北京世纪曙光文化传播有限公司,高课时费诚聘小初高各科优秀老师
4965,台州,3月8日,5-7万/月,三门县台力电机有限公司,数控车工
4966,北京-朝阳区,3月8日,4000元/天,北京市麦道百清文化艺术中心,静物摄影师
4967,东莞,3月8日,10万以上/月,广东邑安实业有限公司,司机助理手游商务
4968,苏州,3月8日,10万以上/月,中南置地苏南城市公司,置业顾问
4969,东莞-寮步镇,3月8日,5-7万/月,东莞市同鸿汽车贸易有限公司,4S店销售经理
4970,常州,3月8日,80-100万/年,新北区三井明月房产信息咨询服务部,常居地产年薪百万营销策划项目经理（六薪）
4971,深圳,3月8日,4500元/小时,深圳市祥光达光电科技有限公司,电子普工
4972,上海-浦东新区,3月8日,7000元/天,上海司羿智能科技有限公司,硬件工程师
4973,重庆-江北区,3月8日,10万以上/月,德纳（重庆）传动技术有限公司,人事经理
4974,东莞-南城区,3月8日,7-10万/月,福建省世新工程营造有限公司广东分...,审计专员/主管
4975,重庆-江北区,3月8日,5-7万/月,重庆励步教育,励步重庆--课程顾问
4976,广州,3月8日,30-60万/月,广州楼盘网网络科技有限公司,网商事业部经理
4977,北京-朝阳区,3月8日,8000元/天,北京凯特领先文化传媒有限公司,对外汉语老师
4978,无锡-梁溪区,3月8日,10000元/天,无锡市贝尔教育培训中心,英语老师  周末班
4979,武汉-江汉区,3月8日,5-7万/月,武汉纬文兄弟国际贸易有限公司,财务主管(生产型出口企业或外贸公司）
